{
  "key": "RBA",
  "name": "United States Dollar",
  "country_code": "DE",
  "rate_type": "reference",
  "pivot_currency": "CNY",
  "data_url": "https://www.ecb.europa.eu/stats/policy_and_exchange_rates/euro_reference_exchange_rates/html/index.en.html",
  "terms_url": "https://www.ecb.europa.eu/stats/policy_and_exchange_rates/euro_reference_exchange_rates/html/index.en.html",
  "start_date": "2026-03-25",
  "end_date": "2026-03-25",
  "publishes_missed": 93,
  "currencies": [
    "EUR",
    "EUR"
  ]
}